{
  "skill": "skill_completeness_v1",
  "verifier_version": "0.2.0",
  "target_skill": "skills/holohub-imaging-ai-segmentator",
  "tier1_structural": {
    "tier_id": "tier1_structural",
    "checks_passed": 19,
    "checks_total": 20,
    "verdict": "fail",
    "blocking_issues": [
      {
        "check": "frontmatter_name_format",
        "pass": false,
        "msg": "name 'holohub_imaging_ai_segmentator' must match ^[a-z0-9-]+$ (lowercase letters, digits, hyphens only \u2014 Anthropic best-practices)",
        "severity": "block"
      }
    ],
    "advisory_issues": []
  },
  "tier2_spec_honesty": {
    "tier_id": "tier2_spec_honesty",
    "checks_passed": 10,
    "checks_total": 11,
    "verdict": "pass",
    "blocking_issues": [],
    "advisory_issues": [
      {
        "check": "at_least_one_fixture",
        "pass": false,
        "msg": "no fixtures under fixtures/ \u2014 add at least one synthetic or public sample",
        "severity": "advisory"
      }
    ]
  },
  "tier3_documentation": {
    "tier_id": "tier3_documentation",
    "verdict": "skipped",
    "reason": "v0.2 \u2014 requires LLM rubric grading of SKILL.md vs manifest consistency, intended-use clarity, presence of not_for section"
  },
  "tier4_tests": {
    "tier_id": "tier4_tests",
    "verdict": "skipped",
    "reason": "v0.2 \u2014 requires test execution + coverage assessment"
  },
  "overall": "fail",
  "blocking_issues_count": 1,
  "advisory_issues_count": 1
}